{
  "$schema": "https://json-schema.org/draft/2020-12/schema",
  "schemaVersion": 1,
  "module": "packages/extension-api/src",
  "strategy": "behavioral-reimplementation",
  "sources": [
    {
      "artifactSha256": "6d39ababf803ad073ade9c2fbdaadc9dbbfc3745f2751856599b64fea673053e",
      "artifactPath": "resources/app/out/vs/workbench/workbench.desktop.main.js",
      "cursorVersion": "3.24.18",
      "origin": {
        "bundle": "workbench.desktop.main.js"
      },
      "recoveryMethod": "differential-test"
    }
  ],
  "license": {
    "spdx": "MIT"
  },
  "containsCursorBrandAssets": false,
  "notes": "API de extensões compatível com Cursor 3.24.18 (ADR-007) reconstruída por comportamento observado; sem ativos de marca ou código proprietário."
}
