{
  "$schema": "https://json-schema.org/draft/2020-12/schema",
  "schemaVersion": 1,
  "module": "packages/context/src/embeddings",
  "strategy": "behavioral-reimplementation",
  "sources": [
    {
      "artifactSha256": "6d39ababf803ad073ade9c2fbdaadc9dbbfc3745f2751856599b64fea673053e",
      "artifactPath": "research/reverse-engineering/cursor-3.24.18/README.md",
      "cursorVersion": "3.24.18",
      "origin": {
        "bundle": "local-context-indexing"
      },
      "recoveryMethod": "public-documentation"
    }
  ],
  "license": {
    "spdx": "MIT"
  },
  "containsCursorBrandAssets": false,
  "notes": "Embeddings locais redistribuíveis (ADR-004): manifesto do modelo sentence-transformers/all-MiniLM-L6-v2 (Apache-2.0) e runtime determinístico até empacotamento ONNX. Nenhum peso proprietário do Cursor."
}
